{
  "schema_version": 1,
  "id": "seventies",
  "screen": [
    512,
    384
  ],
  "runtime_format": "seventies-test1",
  "source": "concept.png",
  "backdrop": "prepared/backdrop.png",
  "fonts": {
    "small": "prepared/small.font",
    "playlist": "prepared/Lat7-Terminus12x6_6x12.font",
    "normal": "prepared/normal.png",
    "selected": "prepared/selected.png"
  },
  "palette": {
    "background": [
      85,
      0,
      0
    ],
    "text": [
      255,
      255,
      170
    ],
    "selection": [
      255,
      170,
      0
    ],
    "selected_text": [
      0,
      0,
      0
    ]
  },
  "assets": [
    {
      "name": "idle",
      "file": "prepared/idle.png",
      "role": "play/pause feedback"
    },
    {
      "name": "pause",
      "file": "prepared/pause.png",
      "role": "play/pause feedback"
    },
    {
      "name": "play",
      "file": "prepared/play.png",
      "role": "play/pause feedback"
    },
    {
      "name": "shuffle_off",
      "file": "prepared/shuffle_off.png",
      "role": "shuffle feedback"
    },
    {
      "name": "shuffle_on",
      "file": "prepared/shuffle_on.png",
      "role": "shuffle feedback"
    },
    {
      "name": "loop_off",
      "file": "prepared/loop_off.png",
      "role": "loop feedback"
    },
    {
      "name": "loop_on",
      "file": "prepared/loop_on.png",
      "role": "loop feedback"
    },
    {
      "name": "volume_0",
      "file": "prepared/volume_0.png",
      "role": "volume feedback"
    },
    {
      "name": "volume_1",
      "file": "prepared/volume_1.png",
      "role": "volume feedback"
    },
    {
      "name": "volume_2",
      "file": "prepared/volume_2.png",
      "role": "volume feedback"
    },
    {
      "name": "volume_3",
      "file": "prepared/volume_3.png",
      "role": "volume feedback"
    },
    {
      "name": "volume_4",
      "file": "prepared/volume_4.png",
      "role": "volume feedback"
    },
    {
      "name": "volume_5",
      "file": "prepared/volume_5.png",
      "role": "volume feedback"
    },
    {
      "name": "volume_6",
      "file": "prepared/volume_6.png",
      "role": "volume feedback"
    },
    {
      "name": "volume_7",
      "file": "prepared/volume_7.png",
      "role": "volume feedback"
    },
    {
      "name": "volume_8",
      "file": "prepared/volume_8.png",
      "role": "volume feedback"
    },
    {
      "name": "volume_9",
      "file": "prepared/volume_9.png",
      "role": "volume feedback"
    },
    {
      "name": "volume_10",
      "file": "prepared/volume_10.png",
      "role": "volume feedback"
    },
    {
      "name": "volume_11",
      "file": "prepared/volume_11.png",
      "role": "volume feedback"
    },
    {
      "name": "progress_track",
      "file": "prepared/progress_track.png",
      "role": "progress background"
    },
    {
      "name": "progress_marker",
      "file": "prepared/progress_marker.png",
      "role": "progress marker"
    },
    {
      "name": "selection_pointer",
      "file": "prepared/selection_pointer.png",
      "role": "selection sprite"
    }
  ],
  "widgets": [
    {
      "name": "w_path",
      "kind": "text",
      "x": 88,
      "y": 237,
      "n": 56,
      "bg": [
        85,
        0,
        0
      ],
      "fg": [
        255,
        255,
        170
      ],
      "rect": [
        88,
        237,
        336,
        12
      ],
      "cell": [
        6,
        12
      ],
      "slot": "text"
    },
    {
      "name": "w_page",
      "kind": "text",
      "x": 451,
      "y": 353,
      "n": 8,
      "bg": [
        85,
        0,
        0
      ],
      "fg": [
        255,
        255,
        170
      ],
      "rect": [
        451,
        353,
        48,
        12
      ],
      "cell": [
        6,
        12
      ],
      "slot": "text"
    },
    {
      "name": "w_count",
      "kind": "text",
      "x": 363,
      "y": 353,
      "n": 13,
      "bg": [
        85,
        0,
        0
      ],
      "fg": [
        255,
        255,
        170
      ],
      "rect": [
        363,
        353,
        78,
        12
      ],
      "cell": [
        6,
        12
      ],
      "slot": "text"
    },
    {
      "name": "w_row0",
      "kind": "text",
      "x": 84,
      "y": 90,
      "n": 58,
      "bg": [
        85,
        0,
        0
      ],
      "fg": [
        255,
        255,
        170
      ],
      "rect": [
        80,
        90,
        353,
        12
      ],
      "cell": [
        6,
        12
      ],
      "slot": "text"
    },
    {
      "name": "w_row1",
      "kind": "text",
      "x": 84,
      "y": 103,
      "n": 58,
      "bg": [
        85,
        0,
        0
      ],
      "fg": [
        255,
        255,
        170
      ],
      "rect": [
        80,
        103,
        353,
        12
      ],
      "cell": [
        6,
        12
      ],
      "slot": "text"
    },
    {
      "name": "w_row2",
      "kind": "text",
      "x": 84,
      "y": 117,
      "n": 58,
      "bg": [
        85,
        0,
        0
      ],
      "fg": [
        255,
        255,
        170
      ],
      "rect": [
        80,
        117,
        353,
        12
      ],
      "cell": [
        6,
        12
      ],
      "slot": "text"
    },
    {
      "name": "w_row3",
      "kind": "text",
      "x": 84,
      "y": 130,
      "n": 58,
      "bg": [
        85,
        0,
        0
      ],
      "fg": [
        255,
        255,
        170
      ],
      "rect": [
        80,
        130,
        353,
        12
      ],
      "cell": [
        6,
        12
      ],
      "slot": "text"
    },
    {
      "name": "w_row4",
      "kind": "text",
      "x": 84,
      "y": 144,
      "n": 58,
      "bg": [
        85,
        0,
        0
      ],
      "fg": [
        255,
        255,
        170
      ],
      "rect": [
        80,
        144,
        353,
        12
      ],
      "cell": [
        6,
        12
      ],
      "slot": "text"
    },
    {
      "name": "w_row5",
      "kind": "text",
      "x": 84,
      "y": 157,
      "n": 58,
      "bg": [
        85,
        0,
        0
      ],
      "fg": [
        255,
        255,
        170
      ],
      "rect": [
        80,
        157,
        353,
        12
      ],
      "cell": [
        6,
        12
      ],
      "slot": "text"
    },
    {
      "name": "w_row6",
      "kind": "text",
      "x": 84,
      "y": 171,
      "n": 58,
      "bg": [
        85,
        0,
        0
      ],
      "fg": [
        255,
        255,
        170
      ],
      "rect": [
        80,
        171,
        353,
        12
      ],
      "cell": [
        6,
        12
      ],
      "slot": "text"
    },
    {
      "name": "w_row7",
      "kind": "text",
      "x": 84,
      "y": 184,
      "n": 58,
      "bg": [
        85,
        0,
        0
      ],
      "fg": [
        255,
        255,
        170
      ],
      "rect": [
        80,
        184,
        353,
        12
      ],
      "cell": [
        6,
        12
      ],
      "slot": "text"
    },
    {
      "name": "w_row8",
      "kind": "text",
      "x": 84,
      "y": 198,
      "n": 58,
      "bg": [
        85,
        0,
        0
      ],
      "fg": [
        255,
        255,
        170
      ],
      "rect": [
        80,
        198,
        353,
        12
      ],
      "cell": [
        6,
        12
      ],
      "slot": "text"
    },
    {
      "name": "w_row9",
      "kind": "text",
      "x": 84,
      "y": 211,
      "n": 58,
      "bg": [
        85,
        0,
        0
      ],
      "fg": [
        255,
        255,
        170
      ],
      "rect": [
        80,
        211,
        353,
        12
      ],
      "cell": [
        6,
        12
      ],
      "slot": "text"
    },
    {
      "name": "w_track",
      "kind": "text",
      "x": 130,
      "y": 254,
      "n": 42,
      "bg": [
        85,
        0,
        0
      ],
      "fg": [
        255,
        255,
        170
      ],
      "rect": [
        130,
        254,
        252,
        12
      ],
      "cell": [
        6,
        12
      ],
      "slot": "text"
    },
    {
      "name": "w_elapsed",
      "kind": "text",
      "x": 195,
      "y": 267,
      "n": 8,
      "bg": [
        85,
        0,
        0
      ],
      "fg": [
        255,
        255,
        170
      ],
      "rect": [
        195,
        267,
        48,
        12
      ],
      "cell": [
        6,
        12
      ],
      "slot": "digits"
    },
    {
      "name": "w_duration",
      "kind": "text",
      "x": 263,
      "y": 267,
      "n": 8,
      "bg": [
        85,
        0,
        0
      ],
      "fg": [
        255,
        255,
        170
      ],
      "rect": [
        263,
        267,
        48,
        12
      ],
      "cell": [
        6,
        12
      ],
      "slot": "digits"
    },
    {
      "name": "w_detail",
      "kind": "text",
      "x": 12,
      "y": 358,
      "n": 23,
      "bg": [
        85,
        0,
        0
      ],
      "fg": [
        255,
        255,
        170
      ],
      "rect": [
        12,
        358,
        138,
        12
      ],
      "cell": [
        6,
        12
      ],
      "slot": "text"
    },
    {
      "name": "w_voltext",
      "kind": "text",
      "x": 421,
      "y": 367,
      "n": 13,
      "bg": [
        85,
        0,
        0
      ],
      "fg": [
        255,
        255,
        170
      ],
      "rect": [
        421,
        367,
        78,
        12
      ],
      "cell": [
        6,
        12
      ],
      "slot": "text"
    },
    {
      "name": "w_play",
      "kind": "art",
      "x": 115,
      "y": 307,
      "asset": "idle"
    },
    {
      "name": "w_shuffle",
      "kind": "art",
      "x": 259,
      "y": 307,
      "asset": "shuffle_off"
    },
    {
      "name": "w_loop",
      "kind": "art",
      "x": 307,